{
  "schema_version": 1,
  "reconciliation_id": "REC-T-V1-EXAMPLE",
  "task_id": "T-V1",
  "classification": "NEEDS_RECONCILIATION",
  "reasons": ["workspace mismatch is present"],
  "workspace": {"workspace_status": "CHANGED", "mismatch": true, "unexpected_files": ["unexpected.py"]},
  "created_at": "2026-08-02T00:00:00Z",
  "evidence_hash": "0000000000000000000000000000000000000000000000000000000000000000"
}
